{
  "payload_id": "PL-YYYYMMDD-NNN",
  "handoff_id": "HO-YYYYMMDD-NNN",
  "type": "code_task",
  "from_agent": "MANUS_MERCER",
  "to_agent": "CHATGPT_MERCER",
  "timestamp": "YYYY-MM-DDTHH:MM:SSZ",
  "scope": "public",
  "priority": "normal",
  "task": {
    "title": "[Short task title]",
    "description": "[Detailed description with full context]",
    "acceptance_criteria": [
      "[Criterion 1]",
      "[Criterion 2]"
    ],
    "input_files": [],
    "output_files": [],
    "ring": "R9",
    "compute_tier": "T0",
    "estimated_tokens": 0,
    "dependencies": [],
    "quest_thread": "QT-000"
  },
  "context": {
    "working_set_snapshot": "",
    "recent_decisions": [],
    "blockers": [],
    "notes": ""
  },
  "result": {
    "status": "pending",
    "artifacts": [],
    "summary": "",
    "tokens_used": 0,
    "follow_up_payloads": []
  }
}
